Card,Set,Mana Cost,Card Type,Color,Rarity,lowScore,highScore,review,power,toughness,textHostage Taker,Ixalan,2UB,Creature  - Human Pirate,Gold,Rare,4.5,,"If all this did was exile the target, Hostage Taker would be a prized early pick. Given that she lets you cast it and keep it forever, she's on the short list of best cards in the set. The opponent has maybe one turn to kill her and prevent the blowout, after which you end up insanely far ahead. I would also prioritize ways to get her back from the graveyard, or cards like Siren's Ruse, since the only thing better than taking one hostage is taking two.",2,3,"When Hostage Taker enters the battlefield, exile another target creature or artifact until Hostage Taker leaves the battlefield. You may cast that card for as long as it remains exiled, and you may spend mana as though it were mana of any type to cast that spell."Ravenous Chupacabra,Rivals of Ixalan,2BB,Creature  - Beast Horror,Black,Uncommon,4.5,,"HAUMPH! This eats anything, with no respect for size, rarity, color, tribe, or anything. With zero work, this is a sick 2-for-1, and one that gives you tempo to boot. With a little effort, you can pick up some graveyard recursion cards and really take your opponent to town. This is in the running for best card in the set, while also being easily the best uncommon.",2,2,"When Ravenous Chupacabra enters the battlefield, destroy target creature an opponent controls."Profane Procession,Rivals of Ixalan,1WB,Legendary Enchantment,Gold,Rare,4,,"Tetzimoc may be better, but I think this is my least favorite card to play against. It's just uber-frustrating to see this in play and know that you are doomed, as they get to kill three of your creatures and then kill you with those creatures. It might be slow enough that it's closer to a 3.5 in Draft, but I can't imagine cutting it from a B/W deck, and I will be taking it early. I've seen it be insane in Sealed every time it's cast, and know it's a windmill slam there. Is the profane part what the opponent thinks when you play this?",,,"{3}{W}{B}: Exile target creature. Then if there are three or more cards exiled with Profane Procession, transform it."Savage Stomp,Ixalan,2G,Sorcery,Green,Uncommon,4,,"The name is perfect here, as this is both savage and a stomping. If you can play a 4-drop Dinosaur and eat their 4-drop on turn 5, you are almost assuredly going to win, and this even has nice enrage bonuses. This is playable outside of Dinosaurs too, so taking it early can never go wrong.",,,Savage Stomp costs {2} less to cast if it targets a Dinosaur you control. Put a +1/+1 counter on target creature you control. Then that creature fights target creature you don't control. (Each deals damage equal to its power to the other.)Tendershoot Dryad,Rivals of Ixalan,4G,Creature  - Dryad,Green,Rare,4,,"The biggest drawback of this card is that it's a nice tender 2/2, ripe for removal. But if the opponent doesn't have a kill spell, it gets out of control quickly. It makes you ascend almost immediately, and then makes two 3/3s per turn cycle (note that it triggers on their turn too). That's a lot of finishing power and an immediate reward.",2,2,"Ascend (If you control ten or more permanents, you get the city's blessing for the rest of the game.). At the beginning of each upkeep, create a 1/1 green Saproling creature token. Saprolings you control get +2/+2 as long as you have the city's blessing."Walk the Plank,Ixalan,BB,Sorcery,Black,Uncommon,4,,"Unless you're unlucky enough to play against the all-Merfolk deck, this is going to be excellent. It's cheap, basically unconditional, and certainly an early pick.",,,Destroy target non-Merfolk creature.Air Elemental,Ixalan,3UU,Creature  - Elemental,Blue,Uncommon,3.5,,"From the first pack of Revised I ever opened until now, Air Elemental has been a powerhouse. A 4/4 flyer for 5 is a great addition to any Limited deck, and you'll be happy to have it.",4,4,FlyingBombard,Rivals of Ixalan,2R,Instant,Red,Common,3.5,,"There's not much to say about this one, so I'm not going to bombard you with words. It's an efficient burn spell that kills most things that need killing, and at instant speed.",,,Bombard deals 4 damage to target creature.Charging Monstrosaur,Ixalan,4R,Creature  - Dinosaur,Red,Uncommon,3.5,,"Ground Rorix has never been so aptly named, as this charges in and puts a beating on the opponent. If you curve into this, you're going to win easily, and even in a not-great draw this carries a lot of weight. It's just too gigantic and runs over chump blockers, making it an awesome threat.",5,5,"Trample, haste"Contract Killing,Ixalan,3BB,Sorcery,Black,Common,3.5,,"Unconditional kill is a fine deal at 4, so paying 5 and getting two Treasures is a contract worth signing. This is playable in every deck but especially good in ramp, so be on the lookout for that strategy if you can pick up a couple.",,,"Destroy target creature. Create two colorless Treasure artifact tokens with ""{T}, Sacrifice this artifact: Add one mana of any color to your mana pool."""Crested Herdcaller,Rivals of Ixalan,3GG,Creature  - Dinosaur,Green,Uncommon,3.5,,"Mini-Regisaur Alpha is a premium uncommon, and an easy addition to any green deck. 6/6 worth of stats (with trample) over two cards is a great deal for 5 mana.",3,3,"Trample. When Crested Herdcaller enters the battlefield, create a 3/3 green Dinosaur creature token with trample."Deeproot Elite,Rivals of Ixalan,1G,Creature  - Merfolk Warrior,Green,Rare,3.5,,"You want a focused deck to really maximize this, but this is a tribal payoff that's more than worth the effort. You only need to generate two counters to be happy, and I can imagine going much deeper than that.",1,1,"Whenever another Merfolk enters the battlefield under your control, put a +1/+1 counter on target Merfolk you control."Emperor's Vanguard,Ixalan,3G,Creature  - Human Scout,Green,Rare,3.5,,"This hits pretty hard, as getting through even once adds a ton of value. It's also a solid 4/3 for 4, so you aren't even paying for the ability. I'd take this, and I'd prioritize ways to get it through once I had it.",4,3,"Whenever Emperor's Vanguard deals combat damage to a player, it explores. (Reveal the top card of your library. Put that card into your hand if it's a land. Otherwise, put a +1/+1 counter on this creature, then put the card back or put it into your graveyard.)"Famished Paladin,Rivals of Ixalan,1W,Creature  - Vampire Knight,White,Uncommon,3.5,,"Famished Paladin is hungry, yet blocking doesn't seem to bother him. Playing this as a 2-mana 3/3 blocker is great, and if you have a couple incidental sources of life gain, he can bash in for a ton of damage. In a defensive deck, this is playable without life gain, and in an aggressive deck, I'd want 3-4 (including at least one lifelink) before being happy with him.",3,3,"Famished Paladin doesn't untap during your untap step. Whenever you gain life, untap Famished Paladin."Firecannon Blast,Ixalan,1RR,Sorcery,Red,Common,3.5,,"This is some high-quality removal, and I'm going to have a blast killing my opponent's 6-drops with it. This clears the way early and snipes large things late, which is a very good deal for only 3 mana.",,,Firecannon Blast deals 3 damage to target creature. Raid — Firecannon Blast deals 6 damage to that creature instead if you attacked with a creature this turn.Forerunner of the Legion,Rivals of Ixalan,2W,Creature  - Vampire Knight,White,Uncommon,3.5,,"I'm never going to call this anything but Vampiric Tutor, and I expect to mention it a lot. It's quite good in a dedicated Vamps deck, especially with token making, and becomes absurd once you have a good uncommon or rare Vamp to search for.",2,2,"When Forerunner of the Legion enters the battlefield, you may search your library for a Vampire card, reveal it, then shuffle your library and put that card on top of it. Whenever another Vampire enters the battlefield under your control, target creature gets +1/+1 until end of turn."Glorifier of Dusk,Ixalan,3WW,Creature  - Vampire Soldier,White,Uncommon,3.5,,"This is actually a less glorified version of Serra Angel, but I'm more than willing to pay 4 life to build my own. You don't have to pay the life all that often, and when you do, it's likely to force through damage or save you life on the attack back.",4,4,Pay 2 life: Glorifier of Dusk gains flying until end of turn. Pay 2 life: Glorifier of Dusk gains vigilance until end of turn.Impale,Rivals of Ixalan,2BB,Sorcery,Black,Common,3.5,,"Efficient and unconditional removal is always good in my book, and this easily wins the race for best black common (even though I don't have a stake in the outcome).",,,Destroy target creature.Imperial Aerosaur,Ixalan,3W,Creature  - Dinosaur,White,Uncommon,3.5,,"Not only does this give you a 3/3 flyer for 4, which is a gift fit for a king, it also forces through a good chunk of damage. This is a great deal for any deck, and not one I'm leaving by the wayside.",3,3,"Flying. When Imperial Aerosaur enters the battlefield, another target creature you control gets +1/+1 and gains flying until end of turn."Lightning Strike,Ixalan,1R,Instant,Red,Uncommon,3.5,,"Lightning never strikes twice, especially now that this is uncommon. It's still just as good as every other time we've seen it, as 3 damage for 2 mana is not a deal I'll ever turn down.",,,Lightning Strike deals 3 damage to target creature or player.Luminous Bonds,Rivals of Ixalan,2W,Enchantment  - Aura,White,Common,3.5,,"Removal is removal, and this should do the trick quite nicely.",,,Enchant creature. Enchanted creature can't attack or block.Merfolk Branchwalker,Ixalan,1G,Creature  - Merfolk Scout,Green,Uncommon,3.5,,"I really like the cost and stats on this one. Every deck will gladly play as many of these as they can-even control. It doesn't count as branching into aggro if your 2-drop draws you a card, right?",2,1,"When Merfolk Branchwalker enters the battlefield, it explores. (Reveal the top card of your library. Put that card into your hand if it's a land. Otherwise, put a +1/+1 counter on this creature, then put the card back or put it into your graveyard.)"Pious Interdiction,Ixalan,3W,Enchantment  - Aura,White,Common,3.5,,"Unconditional removal with a bit of lifegain attached is always a welcome sight, and Pious Interdiction is even relatively efficient to boot. It doesn't stop activated abilities, but you can't have it all, and this is not going to be a card you will be passing very often.",,,"Enchant creature. When Pious Interdiction enters the battlefield, you gain 2 life. Enchanted creature can't attack or block."Pounce,Ixalan,1G,Instant,Green,Common,3.5,,"The common fight spell is usually pretty good, and having enrage synergies (plus large creatures) means this doesn't disappoint. Take it, play it, and be happy you have it.",,,Target creature you control fights target creature you don't control. (Each deals damage equal to its power to the other.)Radiant Destiny,Rivals of Ixalan,2W,Enchantment,White,Rare,3.5,,"In a heavy tribal deck, this is a great card. It's the most effective on Vampires, but any tribe of small creatures you can go deep on will work. Dinos don't need it quite as much, but it's still a solid bonus there. The city's blessing gives you so little that I don't even count it when evaluating the card.",,,"Ascend (If you control ten or more permanents, you get the city's blessing for the rest of the game.). As Radiant Destiny enters the battlefield, choose a creature type. Creatures you control of the chosen type get +1/+1. As long as you have the city's blessing, they also have vigilance."Raging Regisaur,Rivals of Ixalan,2RG,Creature  - Dinosaur,Gold,Uncommon,3.5,,"While this may not measure up to the best Raging flavor text (that honor easily goes to Raging Goblin), a 4 mana 4/4 with a highly relevant attack trigger is awesome in any deck. This picks off x/1s, triggers enrage, and can even attack into a 5/5.",4,4,"Whenever Raging Regisaur attacks, it deals 1 damage to target creature or player."Ranging Raptors,Ixalan,2G,Creature  - Dinosaur,Green,Uncommon,3.5,,"This ranges from good to great, and it's very hard to imagine the Raptors doing worse than getting a 1-for-1. Most of the time it'll trade and pick you up a land, which is fantastic, and if you can trigger the ability yourself you will feel like a clever person indeed.",2,3,"Enrage — Whenever Ranging Raptors is dealt damage, you may search your library for a basic land card, put it onto the battlefield tapped, then shuffle your library."Reaver Ambush,Rivals of Ixalan,2B,Instant,Black,Uncommon,3.5,,"Vanquishing most things you care about is worth 3 mana, making Reaver Ambush premium removal.",,,Exile target creature with power 3 or less.River's Rebuke,Ixalan,4UU,Sorcery,Blue,Rare,3.5,,"Bouncing your opponent's entire board is quite the bounty, and well worth paying 6 mana for. If you start with this, aim to draft an aggressive deck, and you will be rewarded richly.",,,Return all nonland permanents target player controls to their owner's hand.Rowdy Crew,Ixalan,2RR,Creature  - Human Pirate,Red,Mythic Rare,3.5,,"Draw three plus discard two at random is definitely upside, and can often be better than just ""draw a card"" (mostly when your hand isn't that good, which is true for me almost all the time). As for how often this will be big, I'll just leave you in the hands of Frank Karsten, PhD. This card is good and you should play it, though it's not a bomb by any stretch.",3,3,"Trample. When Rowdy Crew enters the battlefield, draw three cards, then discard two cards at random. If two cards that share a card type are discarded this way, put two +1/+1 counters on Rowdy Crew."Seafloor Oracle,Rivals of Ixalan,2UU,Creature  - Merfolk Wizard,Blue,Rare,3.5,,"The floor on this is high, since all it takes is one Merfolk hit before it's paid for itself. Playing this with 1/1 unblockable Merfolk is a great place to be, and makes all the aggressive Merfolk much more appealing. I like tribal build-arounds that look like this, and hope there are plenty.",2,3,"Whenever a Merfolk you control deals combat damage to a player, draw a card."Shapers of Nature,Ixalan,1GU,Creature  - Merfolk Shaman,Gold,Uncommon,3.5,,"The gold uncommons in this set are on point (except you, Belligerent Brontodon-get your butt into gear). Shapers of Nature is an efficient beater with two very powerful activated abilities, plays well in any deck, and would be especially great in a Merfolk deck.",3,3,"{3}{G}: Put a +1/+1 counter on target creature. {2}{U}, Remove a +1/+1 counter from a creature you control: Draw a card."Silvergill Adept,Rivals of Ixalan,1U,Creature  - Merfolk Wizard,Blue,Uncommon,3.5,,"This is a fantastic deal at 2 mana and still castable at 5, making it a high priority for any Merfolk deck. I wouldn't play this outside Merfolk, but would slam it if things are looking fishy.",2,1,"As an additional cost to cast Silvergill Adept, reveal a Merfolk card from your hand or pay {3}. When Silvergill Adept enters the battlefield, draw a card."Vineshaper Mystic,Ixalan,2G,Creature  - Merfolk Shaman,Green,Uncommon,3.5,,"Given that this can target itself, it's at worst a 2/4 for 3, and often much better than that. This is a real reason to draft Merfolk, and is good even if you don't quite get there.",1,3,"When Vineshaper Mystic enters the battlefield, put a +1/+1 counter on each of up to two target Merfolk you control."Adanto Vanguard,Ixalan,1W,Creature  - Vampire Soldier,White,Uncommon,3,,"A 3/1 aggressive beater that's hard to kill is worth a lot, and it can even get indestructible on defense. If your deck isn't interested in attacking, this loses a good amount of value, but it's still probably worth getting in there.",1,1,"As long as Adanto Vanguard is attacking, it gets +2/+0. Pay 4 life: Adanto Vanguard gains indestructible until end of turn. (Damage and effects that say ""destroy"" don't destroy it.)"Atzocan Archer,Ixalan,2G,Creature  - Human Archer,Green,Uncommon,3,,"I like the combo of a solid defender and a nice little ping ability. This will pick off 2/1s, stop 3/3 flyers, and can even trigger your 2/3 or 3/2 enrage creatures (being able to fight your own creatures is uncommon).",1,4,"Reach. When Atzocan Archer enters the battlefield, you may have it fight another target creature. (Each deals damage equal to its power to the other.)"Chart a Course,Ixalan,1U,Sorcery,Blue,Uncommon,3,,"At worst, this is draw 2 then discard 1, which is a serviceable deal for 2 mana. At best, it's a straight-up draw 2, and a card I want in any Limited deck. It's not hard to enable this, and you should be happy to have it in every deck. Even aggressive decks, which often don't want card draw, will play this, as you will almost never have to discard thanks to your frequent attacks.",,,Draw two cards. Then discard a card unless you attacked with a creature this turn.Crashing Tide,Rivals of Ixalan,2U,Sorcery,Blue,Common,3,,"You don't need to have a single Merfolk in your deck for this to be good. Bouncing their biggest creature and crashing in is well worth 3 mana if it doesn't cost you a card, and it just gets better from there. If you do have Merfolk, this is straight-up Repulse, which is an excellent card. I like this card, and doubt I'll be passing it often.",,,Crashing Tide has flash as long as you control a Merfolk. Return target creature to its owner's hand. Draw a card.Curious Obsession,Rivals of Ixalan,U,Enchantment  - Aura,Blue,Uncommon,3,,"Adding +1/+1 to Curiosity is a big game. The extra stats will let your creatures get by theirs more often, and when you have this ability, you want to attack every turn anyway. Plus, if attacks aren't bad, sacrificing this after getting a card or two out of it isn't the end of the world.",,,"Enchant creature. Enchanted creature gets +1/+1 and has ""Whenever this creature deals combat damage to a player, you may draw a card."". At the beginning of your end step, if you didn't attack with a creature this turn, sacrifice Curious Obsession."Dark Nourishment,Ixalan,4B,Instant,Black,Uncommon,3,,"Dark Nourishment at uncommon is a bit surprising, but it's still a fine removal spell and you'll always play it. Being an instant is a relevant upgrade over similar cards we've seen in the past, and against all of the non-Dinosaur decks this should kill whatever needs killing.",,,Dark Nourishment deals 3 damage to target creature or player. You gain 3 life.Deadeye Brawler,Rivals of Ixalan,2UB,Creature  - Human Pirate,Gold,Uncommon,3,,"I like the stats on this, and deathtouch makes it a great blocker. This is the kind of ascend card I like-it's good without ascend, and naturally makes the game into one that lasts long enough for you to hit ascend. Once you draw a card for each hit, this is annoying to deal with, and probably requires a double-block from the opponent.",2,4,"Deathtouch. Ascend (If you control ten or more permanents, you get the city's blessing for the rest of the game.). Whenever Deadeye Brawler deals combat damage to a player, if you have the city's blessing, draw a card."Deadeye Rig-Hauler,Rivals of Ixalan,3U,Creature  - Human Pirate,Blue,Common,3,,"This raid trigger is pretty brutal when you're ahead, making this a card that snowballs easily. It also rewards you for having decent evasive creatures, and is big enough that it is still passable to cast it without raid. This is good, and will make the cut in any blue deck that has decent attackers (which should be all of them in this format). Auras took a hit here, what with Crashing Tide and Deadeye Rig-Hauler, which is something to keep in mind.",3,2,"Raid — When Deadeye Rig-Hauler enters the battlefield, if you attacked with a creature this turn, you may return target creature to its owner's hand."Dire Fleet Neckbreaker,Rivals of Ixalan,2BR,Creature  - Orc Pirate,Gold,Uncommon,3,,"Dire Fleet Neckbreaker hits as a 5/2, but that isn't where most of the power is. Where this really shines is when you can drop it and attack with multiple Pirates, preferably menace or flying ones. If you are firmly in R/B Pirates, I'd bump this to a 3.5, as it threatens to deal a ton of damage and let your 2-drops trade up.",3,2,Attacking Pirates you control get +2/+0.Dusk Legion Zealot,Rivals of Ixalan,1B,Creature  - Vampire Soldier,Black,Common,3,,"I can't ever imagine cutting this from a black deck, regardless of the theme. In Vampires, this is great, and even in Pirates it replaces itself and puts something on the board.",1,1,"When Dusk Legion Zealot enters the battlefield, you draw a card and you lose 1 life."Evolving Wilds,Rivals of Ixalan,,Land,Land,Common,3,,"I love having this in the format. It just makes mana better across the board, and allows for splashes for time to time, which I view as a positive.",,,"{T}, Sacrifice Evolving Wilds: Search your library for a basic land card, put it onto the battlefield tapped, then shuffle your library."Exultant Skymarcher,Rivals of Ixalan,1WW,Creature  - Vampire Soldier,White,Common,3,,"Not only is this a Vampire, it's also efficient. Non-Vampire decks will be happy to play this, and it's an early pick for Vamps. It does require 9+ Plains to be a consistent turn-3 play, so keep that in mind when selecting it.",2,3,FlyingFanatical Firebrand,Rivals of Ixalan,R,Creature  - Goblin Pirate,Red,Common,3,,"I'm always putting one of these in my main deck, and could be talked into two if the format lends itself to lots of x/1s. This can also trigger raid and peck in for damage early, while blocking and taking out a 2/1 or 3/1 later. As with all 1-damage effects, be ready to side them in or out as appropriate, based on what your opponent plays.",1,1,"Haste. {T}, Sacrifice Fanatical Firebrand: It deals 1 damage to target creature or player."Fathom Fleet Boarder,Rivals of Ixalan,2B,Creature  - Orc Pirate,Black,Common,3,,"This is a strong card all around, as a 3/3 for 3 plays well on defense or offense. You'd rather be Pirates, and not lose 2 life, but this is big enough and cheap enough that it's worth playing in any black deck.",3,3,"When Fathom Fleet Boarder enters the battlefield, you lose 2 life unless you control another Pirate."Goblin Trailblazer,Rivals of Ixalan,1R,Creature  - Goblin Pirate,Red,Common,3,,"Evasive 2-mana creatures are always menacing, and this is no exception. It can easily get 4-6 points in early, is a pain to block later, and combines nicely with combat tricks by forcing double-blocks. Cards like this are what make me think the format can't have slowed down much.",2,1,MenaceGolden Demise,Rivals of Ixalan,1BB,Sorcery,Black,Uncommon,3,,"Golden Demise is going to have a wide range of effectiveness. Against some decks, it's going to be an easy 2- or 3-for-1, and against other decks you'll struggle to kill even one creature. I really liked Fiery Cannonade in triple-Ixalan, and while this is a little trickier to get to use, at least it won't ever miss the opponent's creatures. The city's blessing doesn't matter a ton, but every now and then it'll be a reasonable bonus.",,,"Ascend (If you control ten or more permanents, you get the city's blessing for the rest of the game.). All creatures get -2/-2 until end of turn. If you have the city's blessing, instead only creatures your opponents control get -2/-2 until end of turn."Grazing Whiptail,Ixalan,2GG,Creature  - Dinosaur,Green,Common,3,,"Grazing Whiptail is the definition of solid playable. A 3/4 reach for 4 is a good defender and decent attacker, and it's even a relevant creature type.",3,4,ReachHeadstrong Brute,Ixalan,2R,Creature  - Orc Pirate,Red,Common,3,,"Headstrong Brute is going to be one of the aggressive Pirate mainstays in the set, as a 3/3 menace for 3 is a fantastic deal. This will beat the crap out of most opponents, and especially if backed up by removal, can never be effectively blocked. Given that it can't block itself, the normal caveats about not playing this in control decks apply.",3,3,Headstrong Brute can't block. Headstrong Brute has menace as long as you control another Pirate.Jungleborn Pioneer,Rivals of Ixalan,2G,Creature  - Merfolk Scout,Green,Common,3,,"Jungleborn Pioneer is more than just a token 3-drop, and it may be the best way to halt the opponent's offense at common. It interacts well against menace creatures, 4/2s, and 2/1s, while still trading for the plethora of 3/3s for 3. It also gives you a hexproof token for Aura shenanigans, if you are running those. I like this in any green deck, and have been very impressed so far.",2,2,"When Jungleborn Pioneer enters the battlefield, create a 1/1 blue Merfolk creature token with hexproof. (It can't be the target of spells or abilities your opponents control.)"Kitesail Corsair,Rivals of Ixalan,1U,Creature  - Human Pirate,Blue,Common,3,,"This is a solid aggressive 2-drop that should fly in any deck, regardless of tribe. I guess blocking is not back on the menu.",2,1,Kitesail Corsair has flying as long as it's attacking.Kitesail Freebooter,Ixalan,1B,Creature  - Human Pirate,Black,Uncommon,3,,"A Duress with a 1/2 flyer attached is much more interesting, even if it's not a complete freeroll, as the opponent can get their card back with a removal spell. Still, I'd always maindeck this, especially in Pirate/raid decks, and side it out if I saw that my opponent didn't have many targets.",1,2,"Flying. When Kitesail Freebooter enters the battlefield, target opponent reveals his or her hand. You choose a noncreature, nonland card from it. Exile that card until Kitesail Freebooter leaves the battlefield."