Card,Set,Mana Cost,Card Type,Color,Rarity,lowScore,highScore,review,power,toughness,textLegion Conquistador,Both,2W,Creature  - Vampire Soldier,White,Common,3,,"I'll admit-this ended up being a lot better the last time than I expected, and oddly enough, ""last time"" was just one set ago. Having this as a reprint makes a ton of sense, and it's pretty sweet that the Legion continues to conquest. This was good value in Ixalan and will continue to be good value, with slightly more Conquistadors showing up per Draft thanks to Rivals' smaller size.",2,2,"When Legion Conquistador enters the battlefield, you may search your library for any number of cards named Legion Conquistador, reveal them, put them into your hand, then shuffle your library."Legion's Landing,Ixalan,W,Legendary Enchantment,White,Rare,3,,"A 1/1 lifelink for 1 isn't a good deal, but it's not that hard to flip this, and a land that makes 1/1s for only 3 mana gives you a significant long-game advantage. I have this a bit below premium removal since it does so little on the back foot, though it's going to be a great card in good aggressive draws.",,,"When Legion's Landing enters the battlefield, create a 1/1 white Vampire creature token with lifelink. When you attack with three or more creatures, transform Legion's Landing."Lightning-Rig Crew,Ixalan,2R,Creature  - Goblin Pirate,Red,Uncommon,3,,"The Lobbers have upgraded their rig, and now have an extra point of toughness. I like the defensive body in control decks, and like the unblockable damage in aggro decks. All told, this is a card I'm happy to play everywhere, even if I don't have tons of Pirates. Also note that this can attack to trigger raid, if such a thing is needed.",0,5,"{T}: Lightning-Rig Crew deals 1 damage to each opponent. Whenever you cast a Pirate spell, untap Lightning-Rig Crew."Martyr of Dusk,Rivals of Ixalan,1W,Creature  - Vampire Soldier,White,Common,3,,"I really like Martyr of Dusk. It trades off well, is the perfect Vampire to give stat bonuses to, and is resilient to removal. All of that is a great deal for 2 mana, and I like this even outside of Vampire decks.",2,1,"When Martyr of Dusk dies, create a 1/1 white Vampire creature token with lifelink."Moment of Craving,Rivals of Ixalan,1B,Instant,Black,Common,3,,"In a fast format, you're always hungry for cheap removal, and this even gives you 2 life as an extra cushion (and plays well with life gain matters cards). It straight-up kills tons of creatures, or works as a combat trick against slightly bigger ones. As someone who has many moments of craving, this is a good one.",,,Target creature gets -2/-2 until end of turn. You gain 2 life.Mutiny,Rivals of Ixalan,R,Sorcery,Red,Common,3,,"I like this card. It won't always kill exactly what you want to kill, but it's efficient enough that I'll never cut it. It can pick off their second-biggest creature most of the time, and sometimes even get the biggest (if they have multiple creatures of similar size). A 1-mana spell that can kill 2-4 mana creatures easily, and even go bigger, is one I'm interested in.",,,Target creature an opponent controls deals damage equal to its power to another target creature that player controls.Paladin of Atonement,Rivals of Ixalan,1W,Creature  - Vampire Knight,White,Rare,3,,"This seems annoying to play against. If you have it in play, your opponent can't attack without giving you some good value, and when the Paladin dies, you get a nice bit of life back. It starts to get nuts once you have cards that let you pay life, but even straight-up I think this will end up playing well.",1,1,"At the beginning of each upkeep, if you lost life last turn, put a +1/+1 counter on Paladin of Atonement. When Paladin of Atonement dies, you gain life equal to its toughness."Paladin of the Bloodstained,Ixalan,3W,Creature  - Vampire Knight,White,Common,3,,"Not only is Paladin of the Bloodstained a solid set of stats (4/3 total), it's spread across two creatures and features some nice lifelink action. I'm in for all that, and would look for rewards for going wide if I picked up a couple of Paladins.",3,2,"When Paladin of the Bloodstained enters the battlefield, create a 1/1 white Vampire creature token with lifelink."Pirate's Cutlass,Ixalan,3,Artifact  - Equipment,Artifact,Common,3,,"I would never cut this from a Pirate deck, and would even run it with as few as 4 Pirates. The rate is solid enough on its own, and if you can get the first equip for free, you've come out way ahead.",,,"When Pirate's Cutlass enters the battlefield, attach it to target Pirate you control. Equipped creature gets +2/+1. Equip {2} ({2}: Attach to target creature you control. Equip only as a sorcery.)"Raptor Companion,Both,1W,Creature  - Dinosaur,White,Common,3,,"I expect 2-drops to still be important, so this is about as good as it was in Ixalan. This one feels a little stranger to reprint, but it will play just fine.",3,1,Relentless Raptor,Rivals of Ixalan,RW,Creature  - Dinosaur,Gold,Uncommon,3,,"If you somehow end up in an R/W deck that isn't aggressive, this isn't a must-play, but it's solid if your plan is to attack. It sucks that you sometimes just won't be able to cast this (like if they have a 4/4), and a 2-mana 3/3 isn't so amazing that this is an early pick.",3,3,Vigilance. Relentless Raptor attacks or blocks each combat if able.Run Aground,Ixalan,3U,Instant,Blue,Common,3,,"I'm happy playing Run Aground, as it trades for a card and leaves you either up mana or neutral in almost every case. That plus the ability to mess up combat and disrupt the opponent's plays makes it a solid playable that I'll always run.",,,Put target artifact or creature on top of its owner's library.Skulduggery,Ixalan,B,Instant,Black,Common,3,,"I really like how this is going to play. It rewards good combat decisions, and can even pick up a 2-for-1 if you get to kill a 1-toughness creature and win a fight. I'd maindeck up to two without a second thought, even if sometimes you do need to side them out.",,,"Until end of turn, target creature you control gets +1/+1 and target creature an opponent controls gets -1/-1."Sky Terror,Ixalan,RW,Creature  - Dinosaur,Gold,Uncommon,3,,"Gold cards that aren't worth splashing lose a little luster, but this isn't terrorable if you are R/W aggro. I wouldn't first-pick this under most circumstances, but I would be happy playing it.",2,2,"Flying, menace"Skymarch Bloodletter,Ixalan,2B,Creature  - Vampire Soldier,Black,Common,3,,"An efficient flyer with a drain 1 attached sounds good to me, and I don't imagine this will be riding the sideboard very often. I suppose some control decks might not be looking for this level of aggression, but pretty much everyone else will.",2,2,"Flying. When Skymarch Bloodletter enters the battlefield, target opponent loses 1 life and you gain 1 life."Storm Fleet Arsonist,Ixalan,4R,Creature  - Orc Pirate,Red,Uncommon,3,,"A 5-mana 4/4 that picks up a 2-for-1 a good chunk of the time seems like a deal to me, and I'm happy running this as the top end of aggro or the middle of the curve in midrange. As long as you have some creatures that can plausibly attack, this will pull its weight. There are decks where sacrificing a land is extremely painful, and even against aggro, this does add up. Resources are resources, and losing one is bad.",4,4,"Raid — When Storm Fleet Arsonist enters the battlefield, if you attacked with a creature this turn, target opponent sacrifices a permanent."Tempest Caller,Ixalan,2UU,Creature  - Merfolk Wizard,Blue,Uncommon,3,,"In aggressive decks, this is a great finisher, while also being fine to run out on turn 5 or 6 to get a couple of damage through. I wouldn't call it a bomb, but it's exactly what aggro needs to close out games.",2,3,"When Tempest Caller enters the battlefield, tap all creatures target opponent controls."Territorial Hammerskull,Ixalan,2W,Creature  - Dinosaur,White,Common,3,,"The rating here isn't strictly for aggressive decks, as a 2/3 for 3 is passable outside of them, but aggro is where this really hits the nail on the head. If your opponent is trying to block you, this makes things nearly impossible for them, and it's my prediction for the most annoying card by far out of an aggro deck.",2,3,"Whenever Territorial Hammerskull attacks, tap target creature an opponent controls."Thundering Spineback,Ixalan,5GG,Creature  - Dinosaur,Green,Uncommon,3,,"7 is a lot of mana, so I'm not over the moon about this, but it's still going to be great when you ramp into it. It's an engine all by itself, and is a legit way to finish the game in a ramp or control deck.",5,5,Other Dinosaurs you control get +1/+1. {5}{G}: Create a 3/3 green Dinosaur creature token with trample.Tishana's Wayfinder,Ixalan,2G,Creature  - Merfolk Scout,Green,Common,3,,Explore cards are still good.,2,2,"When Tishana's Wayfinder enters the battlefield, it explores. (Reveal the top card of your library. Put that card into your hand if it's a land. Otherwise, put a +1/+1 counter on this creature, then put the card back or put it into your graveyard.)"Traveler's Amulet,Rivals of Ixalan,1,Artifact,Artifact,Common,3,,"Much like Evolving Wilds, I'd play this in most 2-color decks (though it gets worse with tons of 2-drops, unlike Wilds). It enables splashes nicely and is a card I want to open in Sealed.",,,"{1}, Sacrifice Traveler's Amulet: Search your library for a basic land card, reveal it, put it into your hand, then shuffle your library."Unfriendly Fire,Ixalan,4R,Instant,Red,Common,3,,"Being able to hit the opponent makes this a card I'm happy to see, much like any good friend. It's fine to have multiples, and even though it's not the most efficient card in the world, you are never cutting it.",,,Unfriendly Fire deals 4 damage to target creature or player.Vanquish the Weak,Ixalan,2B,Instant,Black,Common,3,,"This hits targets in every deck and does so at instant speed, which is a deal I'll take for 3 mana. Much like every other conditional removal, there is some risk when you have multiples, but unless I was completely smothered in these, I wouldn't worry about it.",,,Destroy target creature with power 3 or less.Voracious Vampire,Rivals of Ixalan,2B,Creature  - Vampire Knight,Black,Common,3,,"A solid threat with an ability that pushes extra damage through is nice, making this a good playable in Vampire decks.",2,2,"Menace. When Voracious Vampire enters the battlefield, target Vampire you control gets +1/+1 and gains menace until end of turn."Watertrap Weaver,Ixalan,2U,Creature  - Merfolk Wizard,Blue,Common,3,,"I like this effect in just about any deck, as it helps push aggression or stabilize when you are behind. It's even a Merfolk, which is a substantial bonus for some decks.",2,2,"When Watertrap Weaver enters the battlefield, tap target creature an opponent controls. That creature doesn't untap during its controller's next untap step."Arterial Flow,Rivals of Ixalan,1BB,Sorcery,Black,Uncommon,2.5,,"This becomes really juicy once you have a Vampire in play, as it's a little thin without one. The format doesn't suggest that discard will be great, so draining for 2 goes a long way. You are affecting the board (essentially) by gaining 2, and that extra life gives you time to take advantage of the 2-for-1 you just got, while also triggering your life gain cards.",,,"Each opponent discards two cards. If you control a Vampire, each opponent loses 2 life and you gain 2 life."Blossom Dryad,Ixalan,2G,Creature  - Dryad,Green,Common,2.5,,"As long as your curve has a decent amount of 5+ drops, this is a fine addition. In a beatdown deck, I'd leave it by the wayside, but otherwise I'm in.",2,2,{T}: Untap target land.Cherished Hatchling,Rivals of Ixalan,1G,Creature  - Dinosaur,Green,Uncommon,2.5,,"The bark on this one is worse than the bite (of its friends). You aren't paying much for the ability, as a 2/1 for 2 is good, but it's hard for things to line up where you have mana up, a Dinosaur, and a fight you want to instigate, all at the right time. Still, the opponent will play scared, making this a card most decks will indeed cherish.",2,1,"When Cherished Hatchling dies, you may cast Dinosaur spells this turn as though they had flash, and whenever you cast a Dinosaur spell this turn, it gains ""When this creature enters the battlefield, you may have it fight another target creature."""Colossal Dreadmaw,Both,4GG,Creature  - Dinosaur,Green,Common,2.5,,"This is slightly worse than Carnage Tyrant, mainly because of the worse stats and the lack of great abilities. It's still a perfectly acceptable finisher, and a card I'll play multiples of in a ramp deck. It doesn't even sound bad to play one in a red-green beatdown deck, as a 6/6 trample is no laughing matter for the opponent.",6,6,TrampleColossal Dreadmaw,Both,4GG,Creature  - Dinosaur,Green,Common,2.5,,"This is slightly worse than Carnage Tyrant, mainly because of the lesser stats and lack of great abilities. It's still a perfectly acceptable finisher, and a card I'll play multiples of in a ramp deck. It doesn't even sound bad to play one in a red-green beatdown deck, as a 6/6 trample is no laughing matter for the opponent.",6,6,TrampleDeeproot Warrior,Ixalan,1G,Creature  - Merfolk Warrior,Green,Common,2.5,,"While strictly a beatdown card, Deeproot Warrior does its job, and does its job well. It gets in without fear, and will be a sought-after part of any aggressive strategy. This is a good card to be aware of since it's quite the on-the-board trick if you block with a 2/2. I expect its kill count to be high at the prerelease.",2,2,"Whenever Deeproot Warrior becomes blocked, it gets +1/+1 until end of turn."Depths of Desire,Ixalan,2U,Instant,Blue,Common,2.5,,"I'd almost always run the first one of these, as a bounce spell that doubles as 1-shot ramp plus minor color fixing is a good deal for 3. Bounce spells do tend to get worse in multiples, as they are intrinsically card disadvantage, but I suspect most decks will desire one or two of these.",,,"Return target creature to its owner's hand. Create a colorless Treasure artifact token with ""{T}, Sacrifice this artifact: Add one mana of any color to your mana pool."""Dire Fleet Interloper,Ixalan,3B,Creature  - Human Pirate,Black,Common,2.5,,"I'm a huge fan of all of the explore cards, though this one is a tick below auto-play because of how badly it fares on defense. It's still a good card, and one you will play almost every time, but in a control deck you can't always afford to spend 4 mana on a creature with a mostly offensive slant.",2,2,"Menace. When Dire Fleet Interloper enters the battlefield, it explores. (Reveal the top card of your library. Put that card into your hand if it's a land. Otherwise, put a +1/+1 counter on this creature, then put the card back or put it into your graveyard.)"Divine Verdict,Rivals of Ixalan,3W,Instant,White,Common,2.5,,"The verdict is in, and this is still playable. It's not efficient, and aggro decks won't love it, but it's playable in just about any white deck.",,,Destroy target attacking or blocking creature.Fathom Fleet Firebrand,Ixalan,1R,Creature  - Human Pirate,Red,Common,2.5,,"Try saying this three times fast, or just skip that and play it in your aggressive decks. This is good on turn 2 and does a respectable job later, which is all you can ask for out of your 2-drop.",2,2,{1}{R}: Fathom Fleet Firebrand gets +1/+0 until end of turn.Fiery Cannonade,Ixalan,2R,Instant,Red,Uncommon,2.5,,"Assuming this doesn't maul your own creatures, I like it in the main deck. It's very effective against Merfolk and Vampires, and can even help against Dinosaurs. Feel free to side it out aggressively, as it's going to be quite bad in some matchups.",,,Fiery Cannonade deals 2 damage to each non-Pirate creature.Frilled Deathspitter,Rivals of Ixalan,2R,Creature  - Dinosaur,Red,Common,2.5,,"It's hard to imagine cutting this from an aggro deck, as it forces through some damage no matter what (even very late in the game). It's a nice combo with Forerunner of the Empire, and annoying to deal with outside of a removal spell. I wouldn't play this in a ramp deck, but in any aggressive deck I'd be frilled to have it.",3,2,"Enrage — Whenever Frilled Deathspitter is dealt damage, it deals 2 damage to target opponent."Giltgrove Stalker,Rivals of Ixalan,1G,Creature  - Merfolk Warrior,Green,Common,2.5,,"Giltgrove Stalker has an annoying little text box, and will sometimes chip in for a solid 4-6 damage before the opponent can muster an appropriate blocker. Plus, if they have to toss a 3/2 or 4/2 in front of it, you're happy about that outcome, and if you can pick up combat tricks the opponent might just run right into them.",2,1,Giltgrove Stalker can't be blocked by creatures with power 2 or less.Heartless Pillage,Ixalan,2B,Sorcery,Black,Uncommon,2.5,,"I'm a fan of Mind Rot in general, and Mind Rot with a Treasure attached is a great deal. Even in decks with few creatures, this will have high points, and midrange decks can make very good use of this card. I wouldn't always slam it in aggro since discarding two isn't an effect they care about a ton, so this is not quite an auto-play.",,,"Target opponent discards two cards. Raid — If you attacked with a creature this turn, create a colorless Treasure artifact token with ""{T}, Sacrifice this artifact: Add one mana of any color to your mana pool."""Inspiring Cleric,Ixalan,2W,Creature  - Vampire Cleric,White,Uncommon,2.5,,"I wouldn't exactly call this inspiring, but it is a solid body that fills out your curve and keeps you alive. You could do a lot worse for 3 mana, though don't be afraid to side it out against control decks or when a 3/2 lines up poorly against opposing 2-drops.",3,2,"When Inspiring Cleric enters the battlefield, you gain 4 life."Jade Guardian,Ixalan,3G,Creature  - Merfolk Shaman,Green,Common,2.5,,"I'm actually in for this. It's a 3/3 hexproof for 4 at worst, and there are plenty of Merfolk that could use +1/+1 counters. I also like that Mark of the Vampire and One With the Wind give you some sick combos, allowing you to build a gigantic Jade Golem if that's what you want to do.",2,2,"Hexproof (This creature can't be the target of spells or abilities your opponents control.). When Jade Guardian enters the battlefield, put a +1/+1 counter on target Merfolk you control."Jadecraft Artisan,Rivals of Ixalan,3G,Creature  - Merfolk Shaman,Green,Common,2.5,,"Jadecraft Artisan packs a reasonable punch, and has good enough stats to be worth including in most green decks. +2/+2 often deals more than 2 extra damage, as it lets you attack when you otherwise couldn't, making this even better than it might look.",3,3,"When Jadecraft Artisan enters the battlefield, target creature gets +2/+2 until end of turn."Knight of the Stampede,Rivals of Ixalan,3G,Creature  - Human Knight,Green,Common,2.5,,"In a dedicated Dino deck, this is an easy 3.0 and could even be better. Playing this on 4 and playing 9 mana worth of Dinos the turn after is not all that hard, and it rumbles in combat well enough once the mana production is over.",2,4,Dinosaur spells you cast cost {2} less to cast.Majestic Heliopterus,Rivals of Ixalan,3W,Creature  - Dinosaur,White,Uncommon,2.5,,"In an aggressive deck with a decent amount of Dinos, this acts as a 5+ power flyer. I'm not super excited about it in Dino ramp because it doesn't block well and you usually don't need that much help winning with your 6-drops. Red-white seems like the natural home here, as this could give the deck the last bits of reach it needs. Also, ""heliopterus""? At that point, couldn't you just call it a helicopter?",2,2,"Flying. Whenever Majestic Heliopterus attacks, another target Dinosaur you control gains flying until end of turn."March of the Drowned,Ixalan,B,Sorcery,Black,Common,2.5,,"I'm a big fan of this card. It's elegant, it plays well, and it's powerful in the right deck, while not being a total miss if things don't line up for it. I'd play this in any deck with 4+ Pirates, and if you have some awesome creatures, you can just run it as Raise Dead without feeling bad.",,,Choose one —. • Return target creature card from your graveyard to your hand. • Return two target Pirate cards from your graveyard to your hand.Perilous Voyage,Ixalan,1U,Instant,Blue,Uncommon,2.5,,"It's a shame this doesn't reward you for bouncing the cards you really want to bounce (expensive ones), but it's still a cheap bounce spell with upside if you do bounce something cheap. Not being able to target your own stuff is a real drawback, so keep that in mind-this has lost a lot of flexibility as a result.",,,"Return target nonland permanent you don't control to its owner's hand. If its converted mana cost was 2 or less, scry 2."Prosperous Pirates,Ixalan,4U,Creature  - Human Pirate,Blue,Common,2.5,,"I really like Prosperous Pirates in a ramp deck. As the top of your curve, they aren't quite as exciting, but getting you to at least 7 mana makes them useful for enabling sweet plays while playing good defense themselves.",3,4,"When Prosperous Pirates enters the battlefield, create two colorless Treasure artifact tokens with ""{T}, Sacrifice this artifact: Add one mana of any color to your mana pool."""Reckless Rage,Rivals of Ixalan,R,Instant,Red,Uncommon,2.5,,"If you have a lot of burly creatures, this goes way up in value, and is a quite powerful card indeed. Besides playing it on your 3-toughness creatures, this is good to cast in response to removal that would kill one of your creatures or after chump-blocking, making it flexible as well as powerful. Enrage is also a consideration, of course.",,,Reckless Rage deals 4 damage to target creature you don't control and 2 damage to target creature you control.Resplendent Griffin,Rivals of Ixalan,1WU,Creature  - Griffin,Gold,Uncommon,2.5,,"I'd be a little higher on this if it was any combo except U/W (or /BG), but I'd still run this if I was in these colors. It goes off pretty nicely once you get the city's blessing, though it's not super exciting before that. Still, a 2/2 flyer for 3 is playable enough that I'm not complaining.",2,2,"Flying. Ascend (If you control ten or more permanents, you get the city's blessing for the rest of the game.). Whenever Resplendent Griffin attacks, if you have the city's blessing, put a +1/+1 counter on it."Sailor of Means,Both,2U,Creature  - Human Pirate,Blue,Common,2.5,,"Another reprint, another card that looks about the same. Ascend makes this a little more appealing, but it hasn't changed in value all that much (unless the format ends up drastically different).",1,4,"When Sailor of Means enters the battlefield, create a colorless Treasure artifact token with ""{T}, Sacrifice this artifact: Add one mana of any color to your mana pool."""Sanguine Glorifier,Rivals of Ixalan,3W,Creature  - Vampire Cleric,White,Common,2.5,,"You need at least a couple other Vamps before this becomes more than just a glorified Hill Giant, and in an all-Vamp deck it becomes great. Pushing through damage and giving you 4/4 of stats for 4 mana is a solid deal, and it doesn't ask a whole lot in terms of deckbuilding.",3,3,"When Sanguine Glorifier enters the battlefield, put a +1/+1 counter on another target Vampire you control."Sea Legs,Rivals of Ixalan,U,Enchantment  - Aura,Blue,Common,2.5,,"I love the flavor on this card, and actually think it is quite good to boot. In a Pirate deck, it's a solid combat trick-making your 2/2 into a 2/4 when it battles their 2-drop is a nice tempo swing. Even outside Pirate decks, it can win combats and permanently shrink evasive creatures. This is a good deal for 1 mana, and 1-mana tricks were very good in the prior format.",,,"Flash. Enchant creature. Enchanted creature gets +0/+2 as long as it's a Pirate. Otherwise, it gets -2/-0."Siegehorn Ceratops,Rivals of Ixalan,GW,Creature  - Dinosaur,Gold,Rare,2.5,,"This combines very nicely with combat tricks, and I'm not in the habit of cutting bears that are in a relevant tribe as-is. It's hard to get ping effects in G/W, so I'm mostly looking at tricks to push this through. Also note that your opponent will almost never block this, as the blowout potential is so high. Maybe this should be a 3.0 due to it being virtually unblockable in the early game?",2,2,"Enrage — Whenever Siegehorn Ceratops is dealt damage, put two +1/+1 counters on it. (It must survive the damage to get the counters.)"Sleek Schooner,Ixalan,3,Artifact  - Vehicle,Artifact,Uncommon,2.5,,"Crew 1 and a low cost do make this sleek enough to run in any deck full of creatures, even if it's not all that exciting.",4,3,Crew 1 (Tap any number of creatures you control with total power 1 or more: This Vehicle becomes an artifact creature until end of turn.)Squire's Devotion,Rivals of Ixalan,2W,Enchantment  - Aura,White,Common,2.5,,"If Mark of the Vampire is good, how can this not be? You get a nice little chump blocker alongside your Aura, and it's 1 mana cheaper to boot. This is good on evasive creatures and otherwise hard-to-kill targets, and because it's only +1/+1 you do need to pick your champion well.",,,"Enchant creature. Enchanted creature gets +1/+1 and has lifelink. When Squire's Devotion enters the battlefield, create a 1/1 white Vampire creature token with lifelink."Thaumatic Compass,Ixalan,2,Artifact,Artifact,Rare,2.5,,"I love the idea of grinding out my opponent with this, as it looks like a solid addition to any control deck. It's as slow as they come, so don't go adding it to your aggro decks, but in midrange or control it can be effective. Once it flips, it does an amazing job of keeping you alive, giving you time to finish the game with whatever you desire.",,,"{3}, {T}: Search your library for a basic land card, reveal it, put it into your hand, then shuffle your library. At the beginning of your end step, if you control seven or more lands, transform Thaumatic Compass."