Card,Set,Mana Cost,Card Type,Color,Rarity,lowScore,highScore,review,power,toughness,textThrash of Raptors,Ixalan,3R,Creature  - Dinosaur,Red,Common,2.5,,"In a midrange Dinosaur deck, this will thrash your opponent very quickly. A 5/3 trample is a great deal for 4, and this plays nicely with fight cards and combat tricks. Outside of Dinosaur decks, this is a marginal playable, but a 3/3 for 4 isn't so bad that you can't run it with just a few other Dinos.",3,3,"As long as you control another Dinosaur, Thrash of Raptors gets +2/+0 and has trample."Aquatic Incursion,Rivals of Ixalan,3U,Enchantment,Blue,Uncommon,2,,"Paying 4 mana for two 1/1s with hexproof is below the bar, so to make this good you need to care about the fact that they are Merfolk and have use for the activated ability. My guess is that more than half of Merfolk decks fit that description, making this a solid card. The unblockable ability does hand you a good late-game plan, and getting some Merfolk to block with and amp up your tribal synergies is a decent package, all told.",,,"When Aquatic Incursion enters the battlefield, create two 1/1 blue Merfolk creature tokens with hexproof. (They can't be the targets of spells or abilities your opponents control.). {3}{U}: Target Merfolk can't be blocked this turn."Brazen Buccaneers,Ixalan,3R,Creature  - Human Pirate,Red,Common,2,,"More aggressive Pirates, more exploring, and more hoping to hit a +1/+1 counter. Ahoy!",2,2,"Haste. When Brazen Buccaneers enters the battlefield, it explores. (Reveal the top card of your library. Put that card into your hand if it's a land. Otherwise, put a +1/+1 counter on this creature, then put the card back or put it into your graveyard.)"Commune with Dinosaurs,Ixalan,G,Sorcery,Green,Common,2,,"In a deck with 10+ Dinosaurs, this provides a good amount of flexibility. A 1 mana spell that can find you lands or threats, depending on what you need, is valuable. The price is that you need Dinosaurs, or this becomes a glorified land, but once you pay that price this is a good addition. It also has what I assume is a playtest name that somehow slipped through, but that doesn't affect game play.",,,Look at the top five cards of your library. You may reveal a Dinosaur or land card from among them and put it into your hand. Put the rest on the bottom of your library in any order.Deadeye Tormentor,Ixalan,2B,Creature  - Human Pirate,Black,Common,2,,"If you can reliably attack and trigger this, it's both efficient and annoying for your opponent. I wouldn't be dead set on playing it in a midrange deck, and likely wouldn't play it in a control deck, because missing the raid trigger makes this the height of mediocrity.",2,2,"Raid — When Deadeye Tormentor enters the battlefield, if you attacked with a creature this turn, target opponent discards a card."Desperate Castaways,Ixalan,1B,Creature  - Human Pirate,Black,Common,2,,"These work well in a defensive deck and are roused to fight at the sight of Treasure, which makes them good in most U/B decks as well. I'm not desperate to pick them up, but I'll be happy to play them more often than not. Later in the Draft, their value can increase as well if you've got a lot of artifacts or are lacking 2s.",2,3,Desperate Castaways can't attack unless you control an artifact.Dire Fleet Captain,Ixalan,BR,Creature  - Orc Pirate,Gold,Uncommon,2,,"In the aggressive Red-Black Pirates deck, this is a threatening beater. Outside of that, things look a little more dire, and I'm not all that interested in playing this. It's a good addition to the deck if you can pick it up later, but I wouldn't take this early and go into it.",2,2,"Whenever Dire Fleet Captain attacks, it gets +1/+1 until end of turn for each other attacking Pirate."Dire Fleet Hoarder,Ixalan,1B,Creature  - Human Pirate,Black,Common,2,,"Decks that want 2/1s don't usually have a super high curve, but Treasure is valuable for every deck, even if it's better with 6+ drops. This looks like a solid way to make sure you have early plays, and has decent value up until the very late game.",2,1,"When Dire Fleet Hoarder dies, create a colorless Treasure artifact token with ""{T}, Sacrifice this artifact: Add one mana of any color to your mana pool."""Jade Bearer,Rivals of Ixalan,G,Creature  - Merfolk Shaman,Green,Common,2,,"This is almost a build-around, even if the Bearer itself is never driving a deck. It's basically unplayable outside dedicated Merfolk, but it's good in that deck, as it adds 2/2 of stats for 1 mana, and can enable synergies as needed.",1,1,"When Jade Bearer enters the battlefield, put a +1/+1 counter on another target Merfolk you control."Mist-Cloaked Herald,Rivals of Ixalan,U,Creature  - Merfolk Warrior,Blue,Common,2,,"I really want to call this unplayable, but in my heart of hearts, I know it isn't. Aggro Merfolk decks will be happy to run this, and I'm sure that U/R Raid decks with Swashbuckling will too. One day, blocking will be legal again.",1,1,Mist-Cloaked Herald can't be blocked.Orazca Frillback,Rivals of Ixalan,2G,Creature  - Dinosaur,Green,Common,2,,"In an aggressive green deck, this is passable, and in a deck that cares about Dinos, it's got a few nice synergies that make it playable. In neither case am I super hyped, but it's a fine card.",4,2,Pirate's Prize,Ixalan,3U,Sorcery,Blue,Common,2,,"I like the combination of drawing cards and getting a bonus mana to pay for them, though I'm aware that not every deck will want expensive card draw. The Prize also goes down as you get multiples, as there are only so many slots you can dedicate to effects like this. As for how many slots, I'm guessing 2-4, though I'm willing to find out what the upper limit is.",,,"Draw two cards. Create a colorless Treasure artifact token with ""{T}, Sacrifice this artifact: Add one mana of any color to your mana pool."""Pterodon Knight,Ixalan,3W,Creature  - Human Knight,White,Common,2,,"You don't need very many Dinosaurs to make Pterodon Knight passable, as a 3/3 for 4 is already nearly good enough (or in the case of mediocre decks, definitely good enough). Just watch out for your Dinosaur being bounced or removed midcombat, as a Knight falling from the sky is not a pretty sight.",3,3,Pterodon Knight has flying as long as you control a Dinosaur.Queen's Agent,Ixalan,5B,Creature  - Vampire Scout,Black,Common,2,,"This is an explorer that really wants to get that +1/+1 counter, especially since you don't really need lands once you've already hit six. I like this as high end, though it can be outclassed by Dinosaurs fairly easily. I also like adding more lifelinkers to the Vampire clan, as it gives you more and more incentives to run pump spells.",3,3,"Lifelink. When Queen's Agent enters the battlefield, it explores. (Reveal the top card of your library. Put that card into your hand if it's a land. Otherwise, put a +1/+1 counter on this creature, then put the card back or put it into your graveyard.)"Raptor Companion,Both,1W,Creature  - Dinosaur,White,Common,2,,"You'll run Raptor Companion more often than not, both for the stats and because it's a cheap Dinosaur that enables a variety of tribal effects. That's a fine deal for 2 mana, so don't expect to float these late.",3,1,Recover,Rivals of Ixalan,2B,Sorcery,Black,Common,2,,"I suspect you'll want exactly 1 Recover in most black decks, as it is a little slow. The more cheap creatures (and good ones) you have, the more room you have for another copy, but beware of getting too bogged down with situational cards like this.",,,Return target creature card from your graveyard to your hand. Draw a card.Rigging Runner,Ixalan,R,Creature  - Goblin Pirate,Red,Uncommon,2,,"In hyper aggressive decks, this can really bring some beats, and if you start with 2-drop into 2-drop plus Rigging Runner, your opponent will certainly feel like things are rigged. Outside of those decks, this is wildly unplayable, so only run this if you are sure that you can support it.",1,1,First strike. Raid — Rigging Runner enters the battlefield with a +1/+1 counter on it if you attacked with a creature this turn.Sailor of Means,Both,2U,Creature  - Human Pirate,Blue,Common,2,,"I like the support for blue ramp here, as this fits perfectly into a control deck. It gives you a good blocker and a one-shot mana accelerant, all of which costs you only 3 mana. Aggressive decks will pass on this, but midrange and control shouldn't.",1,4,"When Sailor of Means enters the battlefield, create a colorless Treasure artifact token with ""{T}, Sacrifice this artifact: Add one mana of any color to your mana pool."""Shaper Apprentice,Ixalan,1U,Creature  - Merfolk Wizard,Blue,Common,2,,"There isn't a huge cost to having this without other Merfolk, as a 2/1 for 2 is only slightly below average. As such, I'd prioritize it in a heavy Merfolk deck, but would still play it with just a few other fishy friends, assuming your curve needs a 2-drop.",2,1,Shaper Apprentice has flying as long as you control another Merfolk.Spire Winder,Rivals of Ixalan,3U,Creature  - Snake,Blue,Common,2,,"Spire Winder, on the other hand, is priced to move. It's a decent-sized flyer for 4 mana, and every now and then gets a nice bump in the late game. No deck needs this, but most blue decks would be happy playing it.",2,3,"Flying. Ascend (If you control ten or more permanents, you get the city's blessing for the rest of the game.). Spire Winder gets +1/+1 as long as you have the city's blessing."Stampeding Horncrest,Rivals of Ixalan,4R,Creature  - Dinosaur,Red,Common,2,,"In a deck that reliably has other Dinos in play, the Horncrest is a solid aggressive threat. Not every Dino deck is aggressive, so I imagine this more as the top of the curve in a R/W deck than the middle part of a R/G deck.",4,4,Stampeding Horncrest has haste as long as you control another Dinosaur.Sun Sentinel,Rivals of Ixalan,1W,Creature  - Human Soldier,White,Common,2,,"Being off-tribe hurts this one quite a bit, and vigilance isn't even a great ability on a 2/2. You're going to play this to fill out your curve, but it's never going to shine.",2,2,VigilanceSun-Crested Pterodon,Rivals of Ixalan,4W,Creature  - Dinosaur,White,Common,2,,"This isn't the worst 5-drop, as it's got solid stats and potentially two good abilities. I like this in defensive decks, and Dinosaurs can lean that way.",2,5,Flying. Sun-Crested Pterodon has vigilance as long as you control another Dinosaur.Thunderherd Migration,Rivals of Ixalan,1G,Sorcery,Green,Uncommon,2,,"In a dedicated Dino deck, this is one of the better 2-drops, as it ramps you right to the part of the curve where Dinos excels (the top part). Outside of Dinos, it's not worth playing, unless you had a busted deck that required splashing. 3 is too much to pay for this effect, while 2 is exciting.",,,"As an additional cost to cast Thunderherd Migration, reveal a Dinosaur card from your hand or pay {1}. Search your library for a basic land card, put it onto the battlefield tapped, then shuffle your library."Unclaimed Territory,Ixalan,,Land,Land,Uncommon,2,,"In a heavy tribal deck, this is likely worth it, though not by a ton. It does add colorless for other cards, but not fixing mana when it comes to spells is a big drawback.",,,"As Unclaimed Territory enters the battlefield, choose a creature type. {T}: Add {C} to your mana pool. {T}: Add one mana of any color to your mana pool. Spend this mana only to cast a creature spell of the chosen type."Verdant Rebirth,Ixalan,1G,Instant,Green,Uncommon,2,,"I have to admit, I'm curious about this card. It's a mediocre way to save a creature, as you have to re-cast it (though that does re-trigger enter-the-battlefield abilities). But it not only is a 2-for-1 when it works-you can effectively cycle it by just firing it off. I think that adds up to enough value that you should almost always play it, and I can see moving up the rating after playing with it a few times.",,,"Until end of turn, target creature gains ""When this creature dies, return it to its owner's hand."". Draw a card."Wind Strider,Ixalan,4U,Creature  - Merfolk Wizard,Blue,Common,2,,"This set of stats and abilities always performs worse than it looks, so I'm going to start low on Wind Strider. 5 is just a lot of mana, and this rarely ends up ambushing the opponent, making it unexciting in a format with a lot of powerful things going on.",3,3,Flash. FlyingAdmiral's Order,Rivals of Ixalan,1UU,Instant,Blue,Rare,1.5,,"Cancel isn't a particularly strong card in this format, and letting you cast it for 1 mana during your combat step doesn't make me admire it all that much more.",,,"Raid — If you attacked with a creature this turn, you may pay {U} rather than pay this spell's mana cost. Counter target spell."Belligerent Brontodon,Ixalan,5GW,Creature  - Dinosaur,Gold,Uncommon,1.5,,"I'm not a huge fan of 7-mana 6/6s, but this does have a bit more going on. Looming Altisaur is real good pals with the Brontodon, despite his belligerence, and I can imagine it being a solid way to top off your curve.",4,6,Each creature you control assigns combat damage equal to its toughness rather than its power.Bishop of the Bloodstained,Ixalan,3BB,Creature  - Vampire Cleric,Black,Uncommon,1.5,3,"In a deck with a light Vampire theme, this doesn't do a lot. It's passable, but you really want to make a huge bloody mess, not just sprinkle a little onto the ground. In a dedicated Vampire deck, this looks like an awesome finisher, and I can imagine it doing 4+ damage easily. Make those tokens and reap the rewards.",3,3,"When Bishop of the Bloodstained enters the battlefield, target opponent loses 1 life for each Vampire you control."Brazen Freebooter,Rivals of Ixalan,3R,Creature  - Human Pirate,Red,Common,1.5,,"Sometimes you need more Pirates, and sometimes you want Treasure. If that's the case, feel free to play this, but don't expect big things-a 3/3 for 4 isn't special, and 1 Treasure doesn't change that too much.",3,3,"When Brazen Freebooter enters the battlefield, create a colorless Treasure artifact token with ""{T}, Sacrifice this artifact: Add one mana of any color to your mana pool."""Cancel,Ixalan,1UU,Instant,Blue,Common,1.5,,"Cancel always hovers between a 1.0 and a 2.5 or so, with the most likely grade being 1.5. Most formats aren't that kind to 3-mana counters that require double-blue, as the payoff for casting it is that you traded 1-for-1 and the punishment for having it sit in your hand is severe. I'd start by assuming this is marginally playable, and upgrade that if it turns out the format is slow enough.",,,Counter target spell.Crash the Ramparts,Ixalan,2G,Instant,Green,Common,1.5,,"Crash the Ramparts lives up to its name, as it will let you crash through for the final points of damage effectively. It's expensive enough that you don't get a ton of value in the early/midgame as you end up spending your whole turn on it, so I wouldn't prioritize it. You want one of these to finish things off, but aren't going to feel too bad if you don't get it.",,,Target creature gets +3/+3 and gains trample until end of turn.Daring Buccaneer,Rivals of Ixalan,R,Creature  - Human Pirate,Red,Uncommon,1.5,3,"If you can reliably play this turn 1, it's a nice pickup. It's a little daring to run this without a lot of Pirates, but it's not the end of the world if you do have to cast it for 3 mana. I'd want 8+ Pirates to make it good, and 4+ to run it begrudgingly.",2,2,"As an additional cost to cast Daring Buccaneer, reveal a Pirate card from your hand or pay {2}."Dinosaur Stampede,Ixalan,2R,Instant,Red,Uncommon,1.5,,"I don't like this in the big Dino deck, as 6+ drops are finishers in their own right. Where it is interesting is in the more midrange/aggressive red-green Dino deck that focuses on 2-5 drops instead. I could see this making the cut, and adding a much needed 4-6 damage at the end of the game.",,,Attacking creatures get +2/+0 until end of turn. Dinosaurs you control gain trample until end of turn.Dusk Charger,Rivals of Ixalan,3B,Creature  - Horse,Black,Common,1.5,,"Neither side of this is exciting. It's a Hill Giant early and a 5/5 by the late game, at which point it's unlikely to be the card with the most horsepower. In decks with a lot of token-making, maybe this gets there, but I'm not overly impressed.",3,3,"Ascend (If you control ten or more permanents, you get the city's blessing for the rest of the game.). Dusk Charger gets +2/+2 as long as you have the city's blessing."Encampment Keeper,Ixalan,W,Creature  - Hound,White,Common,1.5,,"I'd only run Keepers if the base version has some value to your deck, which in this case is a 1/1 first strike. An aggro deck could want that, but no other deck will, and waiting until 8 mana means that the sacrifice ability won't go off all that often. This is another card you probably should play a bit less often than you think.",1,1,"First strike. {7}{W}, {T}, Sacrifice Encampment Keeper: Creatures you control get +2/+2 until end of turn."Fleet Swallower,Ixalan,5UU,Creature  - Fish,Blue,Rare,1.5,,"This is essentially graded as a 7-mana 6/6, because milling half the opponent's library just isn't that relevant an effect if you are attacking with such a monstrous creature. There are some games where that will matter, but for the most part this is an expensive finisher, and not a very notable one at that.",6,6,"Whenever Fleet Swallower attacks, target player puts the top half of his or her library, rounded up, into his or her graveyard."Frenzied Raptor,Ixalan,2R,Creature  - Dinosaur,Red,Common,1.5,,"4/2s trade down for 2-drops too easily for this to be a high priority, but it will make the cut if you care that it's a Dinosaur. There are plenty of decks where that is enough, and it's unlikely anyone else at the table will be stealing this from you.",4,2,Headwater Sentries,Ixalan,3U,Creature  - Merfolk Warrior,Blue,Common,1.5,,"This can help you make headwater in filling out your curve, but that's about it. If you really need a 4-drop, or are a heavy Merfolk deck, there are fishier things you could spend 4 mana on.",2,5,Imperial Lancer,Ixalan,W,Creature  - Human Knight,White,Uncommon,1.5,,"A 2/1 for 1 isn't as good as it looks in Limited, and this only becomes that later in the game, at which point it might just get blanked. Even in a Dinosaur-heavy deck, I'm not excited about this.",1,1,Imperial Lancer has double strike as long as you control a Dinosaur.Ixalli's Keeper,Ixalan,1G,Creature  - Human Shaman,Green,Common,1.5,,"Alongside other 2/2s for 2, this is fine if that's what you're in the market for. The ability costs a ton, so you really are just playing this because you are keeping your curve in mind.",2,2,"{7}{G}, {T}, Sacrifice Ixalli's Keeper: Target creature gets +5/+5 and gains trample until end of turn."Kumena's Speaker,Ixalan,G,Creature  - Merfolk Shaman,Green,Uncommon,1.5,,"In blue-green, this is a fine playable, but outside of that I think I'll pass. I don't want my 2/2 relying on having other creatures in play, as a 2/2 isn't even that good once the game gets to turn 5 or 6.",1,1,Kumena's Speaker gets +1/+1 as long as you control another Merfolk or an Island.Looming Altisaur,Ixalan,3W,Creature  - Dinosaur,White,Common,1.5,,"Looming Altisaur is a defensive Dino that isn't easy to kill, which seems worth it in a dedicated Dino/control deck (ideally both). Otherwise it's not something I'd be looking to play, though I do like it as a sideboard card.",1,7,Mark of the Vampire,Ixalan,3B,Enchantment  - Aura,Black,Common,1.5,,"Slamming this on an evasive creature or something with hexproof is a big game, and does go a long way in making up for the inherent weakness of Auras (they open you up to getting 2-for-1'd by removal and are dead if you don't have a good target). I think this will make its mark in decks with specific targets, and is a fine sideboard card against removal-light opponents. Likewise, feel free to take it out against decks with ample removal and bounce.",,,Enchant creature. Enchanted creature gets +2/+2 and has lifelink.Nest Robber,Ixalan,1R,Creature  - Dinosaur,Red,Common,1.5,,"The best place for this looks to be a lower-curve aggressive Dinosaur deck, likely red-green. Otherwise, it's a mediocre 2/1 that doesn't scale all that well into the late game, though I suppose it can steal a game if you are in a close race.",2,1,HasteNew Horizons,Ixalan,2G,Enchantment  - Aura,Green,Common,1.5,,"Gift of Paradise ended up being a bit better than it looked, and this does have more of an effect on the board. That said, you do need to be a serious ramp deck before this does what you are looking for.",,,"Enchant land. When New Horizons enters the battlefield, put a +1/+1 counter on target creature you control. Enchanted land has ""{T}: Add two mana of any one color to your mana pool."""One With the Wind,Ixalan,1U,Enchantment  - Aura,Blue,Common,1.5,,"I am not a leaf on the wind, and hopefully none of my creatures will be either. I will grant that this card gets games over with quickly, and putting it on a 4/4 Dinosaur is threatening, but I don't mind working a little harder for my wins, instead of hoping the opponent doesn't have a removal spell. If you end up in a blue aggressive deck without many flyers, that's the most likely place for this to appear.",,,Enchant creature. Enchanted creature gets +2/+2 and has flying.Pride of Conquerors,Rivals of Ixalan,1W,Instant,White,Uncommon,1.5,,"Ascend is a tricky mechanic to evaluate. In the normal case, you aren't ascending almost ever in a game of Limited, so the bonus for ascending doesn't seem that likely to occur. But there are cards that generate Treasure and other tokens, which makes ascending a little reliable, at which point you can really start to pay attention to what you're getting. For the most part, I don't want to play ascend cards that aren't good without the city's blessing, and this is one that is fairly mediocre as such. This does push you to make a deck that will hit 10 permanents more often, so bump this in value if your deck looks well-suited for that.",,,"Ascend (If you control ten or more permanents, you get the city's blessing for the rest of the game.). Creatures you control get +1/+1 until end of turn. If you have the city's blessing, those creatures get +2/+2 until end of turn instead."Raiders' Wake,Ixalan,3B,Enchantment,Black,Uncommon,1.5,,"While this can make things look grim for the opponent, it does take a fair amount of work to do its thing. You have to be in a position to attack the opponent each turn, while spending 4 mana on a card that doesn't affect the board at all. For each game that this dominates (which will happen), I suspect there will be multiple games where it does little to nothing. Overall I'm willing to try it as a finisher/high end in a low-curve raid deck, but I'm not high on its prospects.",,,"Whenever an opponent discards a card, that player loses 2 life. Raid — At the beginning of your end step, if you attacked with a creature this turn, target opponent discards a card."Release to the Wind,Rivals of Ixalan,2U,Instant,Blue,Rare,1.5,,"Release to the Wind is a strange card. You mainly want to use it to flicker your own stuff, but in a pinch you can remove opposing creatures from combat or stop something from blocking. Sadly, it doesn't do any of these things efficiently, and paying 3 mana and a card for this isn't really what I'm looking to do.",,,"Exile target nonland permanent. For as long as that card remains exiled, its owner may cast it without paying its mana cost."Rile,Ixalan,R,Sorcery,Red,Common,1.5,,"In a deck with a couple of good enrage targets, this seems like a fine addition. Outside of that, it's not a card I'm excited to play, as giving trample is clearly not worth going through this effort. If you want this, you'll be able to pick up some copies.",,,Rile deals 1 damage to target creature you control. That creature gains trample until end of turn. Draw a card.River Darter,Rivals of Ixalan,2U,Creature  - Merfolk Warrior,Blue,Common,1.5,,"River Darter is a fine filler creature for Merfolk, and might shine in some matchups. I'm not excited about this, but it'll make the cut often enough to take it 6-8th pick.",2,3,River Darter can't be blocked by Dinosaurs.Shake the Foundations,Rivals of Ixalan,2R,Instant,Red,Uncommon,1.5,,"I really like this as a sideboard card, though because it replaces itself it's a passable main deck one as well. It's good with enrage, but isn't earth-shakingly powerful, so I'm not making it a high priority.",,,Shake the Foundations deals 1 damage to each creature without flying. Draw a card.Shipwreck Looter,Ixalan,1U,Creature  - Human Pirate,Blue,Common,1.5,,"One-shot looting is a good way to make this relevant in the late game, though it's not so powerful that it is a card I'm excited about at any point. It's got the same fail case as Shaper Apprentice with a much lower upside, and in a tribe that seems to care about critical mass a lot less. In this case, not looting may be correct.",2,1,"Raid — When Shipwreck Looter enters the battlefield, if you attacked with a creature this turn, you may draw a card. If you do, discard a card."Slash of Talons,Ixalan,W,Instant,White,Common,1.5,,"A Shock that can only target attackers or blockers is not a card I love, especially if there are a lot of large Dinosaurs stomping around. It does pull its weight in control decks, but I suspect most decks can find more talented spells to fill out their removal suite.",,,Slash of Talons deals 2 damage to target attacking or blocking creature.